客户名称,项目名称,项目内容相关信息,项目所在城市,项目发布时间,中标公司,价格
安徽安天利信工程管理股份有限公司,安徽建筑大学2022年节能院科研仪器设备采购项目第5包中标结果公告,货物类主要标的信息（第5包:数字孪生建模基础平台）： 序号 名称 品,合肥,2023-6-1,合肥科益仪器设备有限公司,348000
安徽安天利信工程管理股份有限公司,安徽六安技师学院工业数字孪生系统实训平台采购成交结果公告,,六安,2022-12-30,山东栋梁科技设备有限公司,717000
安徽工程大学,安徽工程大学工业互联网实验室边缘计算3D数字化智能制造平台采购中标结果公告,规格型号 数量 单价 1 数字孪生仿真实训系统 佐标智能 IOA-,芜湖,2023-1-4,安徽佐标智能科技有限公司,4495000
安徽工程大学,安徽工程大学区块链实训平台数字孪生物流与供应链建模仿真实验设备采购中标结果公告,,安徽,2023-1-4,深圳市怡亚通教育发展有限公司,1691000
安徽工程大学,安徽工程大学机械工程学院先进制造仿真与实训实验室数控数字孪生类设备采购中标结果公告,,芜湖,2022-12-5,合肥金瓷机电科技有限公司,4242000
安徽机电职业技术学院,2023年智能制造虚拟工厂建设项目中标结果公告,、主要标的信息 货物类 名称：数字孪生基础实训平台 品牌：博诺 规格型,芜湖,2023-4-21,天津博诺智创机器人技术有限公司,2976500
安徽建筑大学,安徽建筑大学2022年节能院科研仪器设备采购项目第4包中标结果公告,科研仪器设备采购项目（第5包:数字孪生建模基础平台） 投标供应商不满足,合肥,2023-4-4,安徽慕一仪器设备有限公司,628000
安徽理工大学,安徽理工大学2022年实验室设备购置项目（一）中标结果公告,E 5 64000元 第4包 数字孪生智能控制仿真平台 安徽佐标 IO,安徽,2022-11-24,安徽海刚科技发展有限公司,1249000
安徽理工大学,安徽理工大学掘进机器人数字孪生平台中标结果公告,,淮南,2022-9-16,淮南研怀智能科技有限公司,1146000
安徽六安技师学院(六安高级技工学校),安徽六安技师学院工业数字孪生系统实训平台采购[中标通知书],,六安,2022-12-30,山东栋梁科技设备有限公司,717000
安徽省大禹水利工程科技有限公司,数字孪生流域技术咨询服务项目中标公告,,合肥,2023-5-26,安徽东控机电设备有限责任公司,218800
安徽省怀洪新河河道管理局,怀洪新河暨淮水北调工程现代化管理规划的成交公告,发展规划，附怀洪新河暨淮水北调数字孪生建设实施方案。规划的范围为：以省,安徽,2023-2-24,安徽省水利水电勘测设计研究总院有限公司,3080000
安徽省交通运输综合执法监督局,基于数字孪生及视觉诊断的高速公路运行监测与管控关键技术研究,,合肥,2022-7-4,西安长安大学工程设计研究院有限公司,485000
安徽省科学技术协会,安徽省科技馆项目智慧科技馆深化设计及施工一体化服务项目中标（成交）结果公告,,合肥,2023-5-25,科大国创软件股份有限公司,37580000
安徽省水利引用外资办公室,安徽省数字孪生流域（工程）建设技术指南中标通知书,,合肥,2023-4-12,安徽省(水利部淮河水利委员会)水利科学研究院(安徽省水利工程质量检测中心站),1483000
安吉县天荒坪镇人民政府,关于天荒坪镇“美丽余村”田园综合体之驾驶舱及云平台建设工程（余村田园综合体数字化（一期））采购项目的中标(成交)结果公告,村特色场景 3、余村田园综合体数字孪生建模 4、余村田园综合体大脑 5,湖州,2022-10-13,浙江索控科技有限公司,9774981
安阳市高级技工学校,安阳市高级技工学校省级高技能人才培养示范基地项目包件2中标公告,单价 27000（元） 2 数字孪生仿真系统（仿真软件包） 品牌 广,安阳,2023-3-30,北京中科华宇控股集团有限公司,629000
北方民族大学,北方民族大学IOC数字孪生应用开发平台采购项目中标公告,,银川,2023-3-29,宁夏天昱科技有限公司,540000
北京财贸职业学院,北京财贸职业学院2022年分类发展-双高计划-教学类-商学院智慧物流模型组合创意实训室建设成交公告,物汇智科技有限公司 智能供应链数字孪生实训系统；IRT“链服务”数据总,北京,2022-7-14,北京中物汇智科技有限公司,428300
北京建筑大学,市属高校分类发展―未来卓越规划师、设计师、建筑师（三师）人才培养05包中...,、无线中继器、能耗监视工控机、数字孪生行为能力开发工作站等，采购数量详,大兴,2023-4-3,北京航天常兴科技发展股份有限公司,564277
北京交通大学,北京交通大学2022年经管学院科研专项中标公告,字孪生实训平台（含基础课程）；数字孪生接口平台；一体化教学管理平台；数,北京,2022-12-22,北京津发科技股份有限公司,0
北京交通大学,北京交通大学2022年移动专用网络国家工程研究中心科研专项中标公告,AGV自动控制单元；控制系统；数字孪生平台；信息系统开发平台 智昌；智,北京,2022-12-20,中信科智联科技有限公司,662640
北京交通大学,北京交通大学面向高比例新能源接入的变电站二次系统站网协同样机加工中标公告,在线监控与预警设备 北京四方 数字孪生线路保护装置CSC-103A-G,北京,2022-11-25,北京四方继保工程技术有限公司,381900
北京科技大学,0873-2201HW6L0903 北京科技大学数字孪生私有云平台采购中标公告,,海淀,2023-2-27,盛泽睿藤北京科技有限公司,983000
北京科技大学,BJYM22HW087 北京科技大学机电控制系统数字孪生实训平台项目中标公告,,海淀,2023-2-27,深圳市博科系统科技有限公司,976800
北京科技大学,0873-2201HW6L0904 北京科技大学数字孪生数据采集系统采购中标公告,,海淀,2022-12-13,盛泽睿藤（北京）科技有限公司,770000
北京理工大学唐山研究院,北京理工大学唐山研究院数字孪生系统设备采购（二次）成交公告,,河北,2023-1-18,北京众鼎景和科技有限公司,549600
北京轻工技师学院（北京乐器研究所）,北京轻工技师学院（北京乐器研究所）工业机器人实训室升级改造项目中标公告,司 工业数字技术开发平台/工业数字孪生配套开发系统 / 5 1.8万元,海淀,2023-5-19,北京慧科天成科技有限公司,3555816
北京石油化工学院,高质量应用型“人工智能”应用技术实验实训基地建设-综合能源系统仿真与智慧调控(二）第一包、第三包中标公告,深圳源中瑞科技有限公司 基于数字孪生的智慧供能及用能调控平台 YZR,北京,2022-9-14,天津奥利达环保设备有限公司,289850
北京市测绘设计研究院,数字孪生GIS平台开发服务中标公告,,大兴,2023-6-19,北京飞渡科技股份有限公司,1388000
北京市丰台区职业教育中心学校,丰职2023年北京市特色高水平职业院校建设项目-基于自主可控国产化技术生态的智慧城市数字孪生技术实训基地项目教学仪器采购项目,,丰台,2023-6-16,南京中科算通科技有限公司,1585600
北京市科学技术委员会本,创新企业科普联盟示范建设与服务成交公告,进行科普化建设，同时配套研发以数字孪生技术、虚拟增强现实等技术为基础的,海淀,2022-11-25,北京东升科技企业加速器有限公司,992000
北京市仪器仪表高级技工学校,智能制造VR仿真实验室项目中标公告,人拆装&实习实训系统、智能制造数字孪生工程实训平台等，详见招标文件第五,北京,2023-5-16,北京跃创想科技有限公司,2498710
北京市智慧水务发展研究院,智慧水务1.0基础底座（一期）（第1标段：水务大数据中心、水务码管理平台、...,京）技术有限公司联合体 高渲染数字孪生引擎、WebGL三维仿真引擎 D,海淀,2022-12-15,腾讯云计算(北京)有限责任公司、江河瑞通(北京)技术有限公司联合体,29900000
北京同方凌讯科技有限公司,水务数字孪生平台及系统提升改造项目采购结果公告,,北京,2023-3-27,西安辉瑞电子科技有限公司,0
北京智芯微电子科技有限公司,北京智芯微电子科技有限公司电缆数字孪生系统实施成交结果公告,,北京,2022-12-20,宁夏智德网络科技有限公司,675000
北京智芯微电子科技有限公司,北京智芯微电子科技有限公司 2022年第六批集中采购项目 公开竞争性谈判（服务）采购结果公告,022BC05-FF09-2 数字孪生可视化平台研发服务采购 上海梧飞,北京,2022-8-26,纪二千网络科技有限公司,0
北京中电飞华通信有限公司,北京中电飞华通信有限公司2022年第十二次（非物资）公开竞争性谈判（北京地区）成交结果公告,数字孪生评标园区平台功能模块研发 北京中电飞华通信有限公司 辽宁邮电规,北京,2022-11-8,北京中电飞华通信有限公司,0
北京中发展智源人工智能科技发展有限公司,国有自主可控GPU数字孪生算力软硬件产品-中标结果公示,,门头沟,2023-3-28,北京德康世纪科技有限公司,2496000
北京中核华辉科技发展有限公司,零代码数字孪生平台采购采购结果公告,,北京,2022-11-28,北京优锘科技有限公司,0
北仑区经济和信息化局,模具（金属）产业大脑一期项目单一来源采购公示,、行业设备分析）和企业端应用（数字孪生服务、“链上找”服务、产业金融服,浙江,2022-8-31,宁波数桥云科技有限公司,0
毕节市水务局,毕节市水务局关于毕节市（赤水河流域）基于数字孪生水资源精细化管理试点项目（二次）的中标(成交)结果公告,,毕节,2023-1-11,北京金水信息技术发展有限公司,1585000
材料与能源学院,金属材料工程数字孪生系统及高分子材料与工程数字孪生系统采购项目电子竞价结果公告,,广东,2022-11-18,北京象新力科技有限公司,865000
常德财经中等专业学校,常德财经中等专业学校工业机器人数字孪生实训室设备采购-竞争性磋商成交公告,,常德,2022-12-28,湖南易捷达信息科技有限责任公司,1983000
常州工业职业技术学院,常州工业职业技术学院MES与数字孪生实训中心项目成交结果公告,,常州,2022-7-22,北京华航唯实机器人科技股份有限公司,690000
常州机电职业技术学院,常州机电职业技术学院模具数字孪生虚拟仿真建设项目中标（成交）结果公告,,常州,2022-9-29,珠海汉迪自动化设备有限公司,1380000
成都北方石油勘探开发技术有限公司,大数据驱动下的智能测井、气藏预测与数字孪生系统研发项目中标候选人公示,,西安,2022-7-13,中科数智能源科技深圳有限公司,17503000
成都高新技术产业开发区公园城市建设局,成都高新西区地下空间（含综合管线）规划编制项目公开招标中标公告,,成都,2023-6-26,成都市市政工程设计研究院有限公司(联合体成员:深圳市城市规划设计研究院股份有限公司),2480000
成都理工大学,成都理工大学教学及专业认证软件采购项目中标（成交）结果公告,息可视化、虚拟现实、虚拟仿真、数字孪生等技术提供功能丰富的三维图形创作,成都,2022-8-11,成都亚细亚集创科技有限公司,0
成都市成华区人民政府保和街道办事处,成都市成华区人民政府保和街道办事处斑竹社区智慧特色场景营造项目竞争性磋商成交公告,,成都,2022-11-21,成都数字家园科技有限公司,496600
成都市成华区人民政府府青路街道办事处,府青街道数字门岗项目成交结果公告,数字门岗终端，实现“绿码通”“数字孪生社区”等场景的初步呈现。 服务要,成都,2022-7-6,成都交子数字金融投资集团有限公司,187650
成都市公园城市建设管理局,成都市公园城市建设管理局成都市公园城市建设管理智慧云平台（一期）公开招标中标公告,,成都,2023-5-25,中国电信股份有限公司成都分公司,10400000
成都市金牛区行政审批局,成都市金牛区行政审批局智慧蓉城金牛区运行中心一期服务方案设计服务采购项目（二次）公开招标中标公告,及IoT数据等资源，完成金牛区数字孪生基础数据底座的搭建，在此基础上完,成都,2023-5-9,四川通信科研规划设计有限责任公司,420000
成都市龙泉驿区经济和信息化局,成都市龙泉驿区经济和信息化局成都经开区工业经济数字孪生管理平台采购项目(二次)中标（成交）结果公告,,成都,2022-8-19,集商网络科技(上海)有限公司,778000
成都市武侯城市有机更新开发建设有限责任公司,武侯区华西医美健康数字孪生城市建设项目 中标结果公告,,成都,2022-12-30,成都武侯社区科技有限公司,6433700
成都市新经济发展委员会,成都市新经济发展委员会2022成都全球创新创业交易会—第二届国际区块链创新应用博览会GIEF元宇宙线上创交会公开招标中标公告,、区块链等前沿科技为支撑，通过数字孪生技术将物理空间反映在虚拟空间中并,成都,2022-9-29,成都创禾聚力科技有限公司,1965000
成都信息工程大学,成都信息工程大学中长期贷款第二批采购项目公开招标中标结果公告,元) 2 教学仪器 航空发动机数字孪生与综合控制研究中心设备 星宇等,成都,2023-5-18,成都嘉恒科技有限责任公司,1491900
成都研究院,中移（成都）信息通信科技有限公司2022 年智慧教育-教育行业重点产品及应用研究项目（智慧校园数字孪生可视化）_中选结果公示,,成都,2022-11-28,成都掌云天下科技有限公司,0
重庆工贸职业技术学院,智能制造学院采购虚拟仿真实训基地数字孪生实训室设备(CQS22A01833)中标（成交）结果公告,,重庆,2022-10-28,广州引亮智能技术有限公司,1448500
重庆工商大学,智能制造生产规划及数字孪生虚拟仿真实验室建设项目（包1）（2次）(CQS22A01586)中标（成交）结果公告,,重庆,2023-1-17,重庆华中数控技术有限公司,1400000
重庆工商大学,智能制造生产规划及数字孪生虚拟仿真实验室建设和智能汽车教学平台建设项目(CQS22A01586)中标（成交）结果公告,,南岸区,2022-10-25,重庆汇博实验仪器有限公司,361000
重庆建筑工程职业学院,重庆建筑工程职业学院数字设计虚拟仿真实训中心及数字孪生城市研发中心一期(CQS22A01246)中标（成交）结果公告,,巴南区,2022-8-18,重庆政经信息科技有限公司,599500
重庆建筑工程职业学院,重庆建筑工程职业学院数字孪生空间虚拟仿真实训资源项目竞争性谈判结果公示,,南岸区,2022-7-8,重庆贝锦科技有限公司,0
重庆市公路事务中心,重庆市普通公路数字孪生技术研究与示范结果公告,,重庆,2022-8-29,重庆市公路数据服务中心,149000
滁州市明湖建设管理服务中心,安徽省滁州市明湖幸福河湖建设项目（明湖数字流域建设）中标结果公告,测体系、基础设施建设、明湖流域数字孪生底板构建等内容 服务要求：按合同,滁州,2022-9-29,安徽省滁州市明湖幸福河湖建设项目,23191618
淳安县千岛湖生态综合保护局,淳安县小流域（武强溪）洪涝风险管理数字孪生平台网络安全及机房环境建设项目中标公告,,杭州,2023-2-8,浙江远算科技有限公司,286000
慈溪市自然资源和规划局,浙江天成项目管理有限公司关于慈溪市数字孪生空间底座建筑实体数据资源建设项目的中标(成交)结果公告,,宁波,2023-4-23,慈溪市土地勘测规划设计院有限公司、浙江省测绘科学技术研究院(联合体),2380000
大连口岸物流网股份有限公司,大窑湾海关可视化监控平台数字孪生技术服务结果公告,,大连,2022-12-5,北京帮威客科技有限公司,0
大连理工大学,大连理工大学等温滴定微量热仪采购项目成交公告,2-09 大连理工大学工业装备数字孪生数据管理与优化设计综合平台采购项,上海,2022-12-13,上海思百吉仪器系统有限公司,1300000
大连理工大学,大连理工大学扫描电化学显微镜采购项目成交公告,2-09 大连理工大学工业装备数字孪生数据管理与优化设计综合平台采购项,上海,2022-12-12,大连合锐科学仪器有限公司,1600000
道路与交通工程教育部重点实验室,道路与交通工程教育部重点实验室 三相映射交通数字孪生集成系统（子系统...,,上海,2023-3-28,北京万集科技股份有限公司,29525000
东北大学,【服务】钢铁流程数字孪生标准试验验证平台软件功能测试（二次）成交结果公告,,沈阳,2023-5-10,机械工业仪器仪表综合技术经济研究所,385000
东北大学,【贴息贷款】数字孪生建模平台采购项目（贴息贷款）（三次） 成交结果公告,,沈阳,2022-12-15,重庆瞰图科技有限公司,438000
东北大学,【贴息贷款】数字孪生驱动的可视化智能监控与性能评估智能系统--数据展示系统成交结果公告（TXD22251）,,沈阳,2022-12-12,长春市新瑞国科电子科技有限公司,1560000
东北大学,端边云协同的全生命周期设备智能远程运维平台--服务器部分（贴息贷款）中标公告,512704 2 选矿设备运维数字孪生系统 浪潮 NF5468M6 1,辽宁,2022-12-12,辽宁育能科技有限公司,2400813
东北大学,【贴息贷款】基于数字孪生的复杂工业综合智能控制系统--过程对象模型训练服务器集群中标公告（TXD22227）,,沈阳,2022-12-11,辽宁邮电规划设计院有限公司,2508000
东北大学,东北大学基于工业互联网的轧制过程动态数字孪生子平台--金属材料数据平台（贴息贷款）单一来源成交公告,,辽宁,2022-12-9,钢铁研究总院有限公司,1480000
东北大学,【贴息贷款】端边云协同基于数字孪生的高性能控制系统设计平台--端边云协同高性能控制系统成交结果公告（TXD22242）,,沈阳,2022-12-9,沈阳泰科电气设备有限公司,465000
东北大学,【贴息贷款】数字孪生驱动的基于数字孪生的高性能控制系统设计平台--数字孪生高性能控制系统成交结果公告（TXD22246）,,沈阳,2022-12-9,沈阳德丰自动化系统有限公司,385000
东北大学,【贴息贷款】数字孪生驱动氧化铝成交结果公告（TXD22241）,,沈阳,2022-12-8,净和（辽宁）机电制造有限公司,792500
东北大学,基于数字孪生的复杂工业综合智能控制系统--选别过程控制系统（贴息贷款）成交公告,,辽宁,2022-12-7,沈阳泰科电气设备有限公司,1237300
东北大学,基于数字孪生的复杂工业综合智能控制系统--有色过程控制系统（贴息贷款）成交公告,,辽宁,2022-12-6,克夫曼智能工业科技（沈阳）有限公司,1354000
东北大学,东北大学数字孪生驱动生产要素可视化检测、预测、回溯、决策与控制一体化智能系统--数字孪生决策系统（贴息贷款）成交公告,,辽宁,2022-12-5,沈阳艾悠辰科技有限公司,1083000
东北大学,数字孪生驱动的生产过程运行优化与控制智能系统--运行优化与控制数字孪生服务器集群（贴息贷款）成交公告,,辽宁,2022-12-3,沈阳皓翔科技有限公司,1231500
东北大学,东北大学数字孪生驱动的可视化智能监控与性能评估智能系统--数字孪生性能评估系统（贴息贷款）成交公告,,辽宁,2022-12-2,沈阳艾比利电子科技有限公司,1537000
东北大学,端边云协同的生产过程运行优化与控制智能系统--端边云协同运行控制数字孪生服务器集群（贴息贷款）成交公告,,辽宁,2022-11-30,辽宁荣科智维云科技有限公司,1239800
东方电气集团(四川)物产有限公司,物资保障部燃机热障涂层制备用等离子喷涂系统数字孪生技术开发,,深圳,2022-7-14,深圳十沣科技有限公司,0
东方电气集团东方电机有限公司,【东方电气集团东方电机有限公司】发电设备数字孪生智能运维基础应用软件及试点应用开发-中标公告,,上海,2023-2-10,上海数巧信息科技有限公司,0
东方电气集团科学技术研究院有限公司,东方锅炉数字化车间数字孪生系统及集控室硬件采购项目-中标公告,,四川,2023-5-5,四川宏华电气有限责任公司,0
东平宜居建设工程项目管理有限公司,东平县黄河流域水生态保护综合治理项目-基于数字孪生技术的东平县水系连通及水美乡村标准化综合运行管理平台(含东平县智慧水利工程标准化运行管理系统)中标结果公告,,泰安,2022-9-7,山东大禹水务建设集团有限公司,3884400
东阳数据资源有限公司,泰宇建筑工程技术咨询有限公司关于数字孪生金华横锦水库综合应用（一期）的中标结果公告,,金华,2022-11-8,浙江广川工程咨询有限公司,5566000
东营市技师学院,东营市技师学院东营市中等专业学校电气（化学）工程系光机电一体化设备...,）工程系光机电一体化设备升级为数字孪生系统项目 山东栋梁科技设备有限公,东营,2022-11-2,山东栋梁科技设备有限公司,483000
鄂尔多斯市农牧局,鄂尔多斯市农牧局2023年06月政府采购意向,"，实现馆内6个园区的VR展示和数字孪生展示。 2,000.0000 2",鄂尔多斯,2023-6-14,,0
佛山科学技术学院,弹药智能装配平台建设,弹药装配全过程数字孪生演示平台 昕光,株洲,2022-10-31,株洲市昕光机械设备有限公司,2000000
福建发展高速公路股份有限公司,G15沈海高速泉厦段扩容工程智慧高速建设技术指导服务SZ2合同段中标候选人公示（暨中标结果公示）,评估研究 7、高速公路交通运行数字孪生及泉厦扩容交通运行仿真决策平台研,福州,2023-3-30,深圳市城市交通规划设计研究中心股份有限公司,17009570
福建福清核电有限公司,福清核电基于数字孪生技术的核电厂厂用电系统智慧运检技术研究及应用开发项目中标结果公告,,福州,2023-2-24,清华大学,0
福建省电力建设工程咨询有限公司,福建亿力集团有限公司2022年第十批次采购项目(1322YLFF10)公开竞争性谈判项目成交结果公告,省级机房数字孪生场景配置实施 包1,厦门,2022-10-27,福建榕图电力科技有限公司,0
福建省九龙江北溪水资源调配中心,数字孪生九龙江北溪建设先行先试项目设计采购安装服务总承包中标结果公示,,福建,2022-10-14,福建省水利水电勘测设计研究院有限公司,25212110
福建省上杭职业中专学校,上杭职专2022年工业数字孪生系统设备采购项目结果公告(包1),,龙岩,2022-12-28,福建城事网络科技有限公司,739000
福建信息职业技术学院,福建信息职业技术学院物智学院技术应用推广中心设备采购项目结果公告（合同包 1 ）,"心设备 北京优锘科技有限公司 数字孪生应用中心设备,详见采购文件。 1",福州,2023-4-11,北京优锘科技有限公司,465000
福建信息职业技术学院,福建信息职业技术学院建工学院数字测图虚拟仿真综合实训室建设采购项目成交公告,厦门市规划数字技术研究中心 数字孪生模型制作; 数字孪生仿真平台 厦,福建,2022-11-11,厦门市规划数字技术研究中心,390000
福建信息职业技术学院,福建信息职业技术学院工业机器人虚拟仿真实训中心建设项目（货物类采购项目）结果公告(包1),A033412 教学专用仪器 数字孪生基础教学实训台 华航唯实 华航唯,福州,2022-11-11,北京华航唯实机器人科技股份有限公司,1169500
福建亿力电力科技有限责任公司,国网信息通信产业集团有限公司2023年第三次授权（非物资）公开竞争性谈判（福建地区）成交结果公告,3SQFJ-FF35 智慧中枢数字孪生平台开发服务 国网信通亿力科技有,厦门,2023-4-17,山东赛瑞思信息科技有限公司,0
福州市城乡建总集团有限公司,建总大厦数字孪生平台建设项目项目的中标结果公告,,福州,2023-5-11,深圳开鸿数字产业发展有限公司,0
福州市水利局,福州溪源溪小流域（溪源水库）数字孪生建设项目（一期）,,福州,2023-6-19,四创科技有限公司,91800
阜阳科学技术学校,阜阳科学技术学校工业数字孪生设备采购项目成交结果公告,,阜阳,2023-5-12,合肥泓齐教育设备有限公司,734000
阜阳市城市资产投资经营有限责任公司,阜阳市建投资管智慧服务平台建设项目成交结果公告,包括但不限于资产管理中心、资产运营中心、用户管理中心、客户服务中心、线上报修派修系统、周转房线上受理及签约系统、合同管理、大数据分析系统、资产数字孪生可视化、场景配置管理、资产孪生建模、资产720°全景沙盘、资产分析总览、财务分析总览、资产安全态势总览、客户综合服务总览。详见竞争性谈判文件采购需求,阜阳,2023-5-27,阜阳市大数据资产运营有限公司,2720000
