浙江高信技术股份有限公司云研究院,多传感器融合平台关键技术研究及应用-数字孪生交通流组件技术服务采购项目中标公告,,杭州,2022-12-16,杭州十域科技有限公司,700000
浙江高信技术股份有限公司云研究院,面向智慧交通的关键技术研究及应用示范-数字孪生典型应用开发技术服务采购项目中标公告,,杭州,2022-11-29,杭州十域科技有限公司,260000
浙江高信技术股份有限公司云研究院,面向智慧交通的关键技术研究及应用示范-数字孪生无码装配器开发服务采购项目中标公告,,杭州,2022-11-15,杭州十域科技有限公司,648000
浙江高信技术股份有限公司云研究院,面向智慧交通的关键技术研究及应用示范-数字孪生API中间件开发服务采购项目中标公告,,杭州,2022-10-21,杭州十域科技有限公司,348000
浙江高信技术股份有限公司云研究院,面向智慧交通的关键技术研究及应用示范-数字孪生模型制作技术服务采购项目【重新采购】中标公告,,浙江,2022-10-17,南京泛在地理信息产业研究院有限公司,278000
浙江高信技术股份有限公司云研究院,多传感器融合平台关键技术研究及应用—数字孪生虚幻引擎前端API开发技术服务项目中标公告,,杭州,2022-9-29,浙江浙蕨科技有限公司,404252
浙江高信技术股份有限公司云研究院,面向智慧交通的关键技术研究及应用示范-数字孪生模型制作技术服务采购项目【重新采购】中标候选人公示,,杭州,2022-9-28,南京泛在地理信息产业研究院有限公司,278000
浙江高信技术股份有限公司云研究院,数字孪生基础底座平台技术咨询项目中标公告,,杭州,2022-8-29,杭州十域科技有限公司,270000
浙江高信技术股份有限公司云研究院,数字孪生基础底座建设前端技术服务项目【重新采购】中标公告,,杭州,2022-8-22,杭州欣悦互联科技有限公司,240000
浙江建设技师学院,关于浙江建设技师学院数字孪生项目管理实训室改造项目的中标(成交)结果公告[德邻联合工程有限公司],,浙江,2023-5-4,杭州山迪科技有限公司,1895760
浙江建设技师学院(本级),德邻联合工程有限公司关于浙江建设技师学院数字孪生项目管理实训室改造项目的中标(成交)结果公告,,杭州,2023-5-4,,0
浙江建投环保工程有限公司->浙建环保本部,数字孪生污水处理厂平台开发任务招标结果,,浙江,2022-10-17,,0
浙江镜岭水库有限公司,浙江镜岭水库工程数字孪生系统（一期）全过程咨询服务项目中标公告,,绍兴,2023-6-8,山东正中信息技术股份有限公司,0
浙江省测绘科学技术研究院,关于数字孪生公路全景平台研发协作服务项目的成交结果公告[浙江省国际技术设备招标有限公司],,浙江,2022-9-14,青岛数字世界信息科技有限公司,432500
浙江省公众信息产业有限公司,地信小镇数字孪生可视化平台智能化建设项目采购中选人结果公示,,浙江,2022-9-13,杭州云栖云数据有限公司,0
浙江省公众信息产业有限公司地,长兴“龙之梦”景区安全监管数字孪生数据仓项目单一来源采购公告,,浙江,2022-8-29,,0
浙江省湖州市南浔区应急管理科技教育中心,关于南浔区涉爆粉尘场所除尘系统安全生产监测预警数字孪生应用场景项目的中标(成交)结果公告[浙江恒盛工程咨询有限公司],,湖州,2022-7-14,浙江浔数科技有限公司,1950000
浙江省湖州市南浔区应急管理科技教育中心,浙江恒盛工程咨询有限公司关于南浔区涉爆粉尘场所除尘系统安全生产监测预警数字孪生应用场景项目的中标(成交)结果公告,,湖州,2022-7-14,浙江浔数科技有限公司,0
浙江省交通运输科学研究院,关于省重点研发项目-基于数字孪生的智慧高速公路交通流全时空管控关键技术及应用示范-系统开发、测试、建模的中标(成交)结果公告[浙江敬霖工程咨询有限公司],,浙江,2023-4-26,浙大网新系统工程有限公司,2023
浙江省交通运输科学研究院,基于数字孪生的智慧高速公路交通流全时空管控关键技术及应用示范-测试化验加工中标公告,,浙江,2022-10-31,浙江省机电产品质量检测所有限公司,280000
浙江省交通运输科学研究院,浙江敬霖工程咨询有限公司关于2021省重点课题（科技厅）-基于数字孪生的智慧高速公路交通流全时空管控技术及应用-测试化验加工（一期）的中标（成交）结果公告,,杭州,2022-8-16,上海电科智能系统股份有限公司,667000
浙江省交通运输厅,关于省交通运输厅(本级)铁路沿线安全环境空天地一体化排查系统研究项目的中标(成交)结果公告[浙江省国际技术设备招标有限公司],感知技术（3）铁路安全环境毁损数字孪生及快速综合评估方法（4）铁路沿线,浙江,2023-5-12,杭州铁路设计院有限责任公司,1960000
浙江省平湖技师学院,平湖市公共资源交易中心关于浙江省平湖技师学院工业互联网实训室、数字孪生实训、工业机器人虚拟仿真实训室设备采购项目的中标(成交)结果公告,,嘉兴,2023-1-6,,0
浙江省平湖技师学院,平湖市公共资源交易中心关于浙江省平湖技师学院工业互联网实训室、数字孪生实训、工业机器人虚拟仿真实训室设备采购项目的中标(成交)结果公告,,嘉兴,2023-1-6,杭州恒瑞教学设备有限公司,2095040
浙江省生态环境监测中心,关于省生态环境监测中心浙江省碳监测能力建设项目的中标(成交)结果公告[浙江省政府采购中心],时间 服务标准 1 数据组网和数字孪生应用场景（一期） 详见附件 详见,浙江,2022-11-23,浙江环信环境自动检测有限公司,6907000
浙江数智交院科技股份有限公司,管理体系数字孪生平台(第一部分)代码编写劳务外采服务中标公告,,杭州,2023-3-31,杭州晟轩云科技有限公司,198100
浙江数智交院科技股份有限公司,桐庐县迎亚运智慧公路项目(G320、S208、S305)数字孪生外场设备及算法中标公告,,杭州,2023-1-6,浙江数智交院科技股份有限公司,1871300
浙江数智交院科技股份有限公司,公司合规管理体系建设专项法律服务直采公示,原因说明： 为配合公司管理体系数字孪生平台建设工作，公司于2022年6,杭州,2022-10-18,浙江律匠律师事务所,0
浙江同济科技职业学院,关于浙江同济科技职业学院数智同科数字孪生一张图平台（一期）中标(成交)结果公告[浙江省成套招标代理有限公司],,杭州,2023-6-28,浙江中海达空间信息技术有限公司,722800
浙江移动信息系统集成有限公司,数字孪生平台虚拟引擎工作电脑和演示电脑采购项目-中选候选人公示,,杭州,2022-9-8,灵通智联杭州科技有限公司,0
浙江智港通科技有限公司,浙江智港通科技有限公司数字孪生模型项目中标公示,,杭州,2022-11-25,杭州美创科技股份有限公司,320000
中电福富信息科技有限公司,2023年中电福富智慧园区数字孪生软件开发服务项目单一来源采购公示,,福州,2023-2-14,泉州乐石科技有限公司,0
中电福富信息科技有限公司,2022年中电福富信息科技有限公司城市数字孪生关键技术及新应用研发项目雄安鑫城三维模型采购公开询价项目成交人公示,,,2022-7-22,四十五度视介观信息科技有限公司,0
中电鸿信信息科技有限公司,【中电鸿信】数字孪生技术服务采购项目单一来源采购公示,,江苏,2023-2-14,湖南航天宏图无人机系统有限公司,0
中电科大数据研究院有限公司,中电科大数据研究院有限公司基于BIM的“数字孪生选煤厂”构建与三维可视化管理平台应用关键技术——选煤厂数据采集实施外包外协采购中标公示,,北京,2023-4-13,北京龙睿海拓科技发展有限责任公司,0
中电万维信息技术有限责任公司,关于“文旅视频AI分析和监测平台建设项目数字孪生开发工具及三维模型优化服务采购”的公开询价结果公示,,北京,2022-8-23,,0
中电万维信息技术有限责任公司,关于“智慧园区数字孪生平台项目数字孪生平台及建模软件开发服务”的单一来源采购公示,,兰州,2022-7-8,成都四方伟业软件股份有限公司,0
中共鄂尔多斯市委员会,中共鄂尔多斯市委员会宣传部“鄂尔多斯数字展馆”项目成交公告,广平台优势； 2.数字展馆依托数字孪生裸眼VR全景技术搭建的全景沉浸式,内蒙古,2022-10-17,人民网股份有限公司,500000
中共鄂尔多斯市委员会宣传部,中共鄂尔多斯市委员会宣传部“鄂尔多斯数字展馆”项目二期成交公告,广平台优势； 2.数字展馆依托数字孪生裸眼VR全景技术搭建的全景沉浸式,内蒙古,2023-6-13,人民网股份有限公司,495000
中广核工程有限公司,核电厂主变压器数字孪生体开发服务采购结果公示,,保定,2023-5-15,保定天威新域科技发展有限公司,0
中广核工程有限公司,施工总平面管理系统第三阶段开发与应用项目项目单一来源信息公告,建模、城市信息模型（CIM）等数字孪生技术为核心的数字化转型服务商。已,广州,2023-3-28,广州星空众联信息技术有限公司,0
中广核工程有限公司,核电厂主变压器数字孪生体开发服务采购结果公示,,保定,2022-11-22,保定天威新域科技发展有限公司,0
中广核工程有限公司,数字孪生的蒸汽发生器运行状态监测和智能故障诊断研究专题采购结果公示,,深圳,2022-11-22,深圳秩益科技有限责任公司,0
中国-东盟信息港股份有限公司,中国—东盟信息港股份有限公司数字孪生信息展示及交互平台采购项目成交结果公告,,桂林,2022-8-15,北京百度网讯科技有限公司,0
中国船舶集团有限公司第七一九研究所,基于数字孪生的数字化设计技术研究项目中标公告,,,2022-10-26,哈尔滨工程大学,265000
中国船舶集团有限公司第七一一研究所,柴油机数字孪生建模与管理系统-结果公告,,海淀,2022-12-5,北京天泽智云科技有限公司,4690000
中国船舶集团有限公司系统工程研究院,XX数字孪生异构集成关键技术研究采购中标公告,,北京,2022-11-17,北京润科通用技术有限公司,1494600
中国船舶集团有限公司系统工程研究院,XX数字孪生建模与信息交互关键技术研究采购中标公告,,北京,2022-11-17,北京神州飞航科技有限责任公司,1468000
中国船舶科学研究中心,数字孪生体系架构设计软件模块,,苏州,2022-11-21,上海烜翊科技有限公司,0
中国大唐集团科学技术研究院有限公司中南电力试验研究院,大唐中南电力试验研究院大唐滑县平原地区风力发电智慧（智能）电厂基于数字孪生的陆上风电三维在线监测项目建设服务结果公告,,安阳,2023-6-21,北京合众伟奇科技股份有限公司,0
中国地质大学（武汉）,中国地质大学（武汉）钻进过程协调优化控制数字孪生系统中标（成交)结果公告,,湖北,2022-12-19,浙江中控技术股份有限公司,2950000
中国地质大学（武汉）,中国地质大学（武汉）流程工业智能制造与数字孪生系统成交公告,,湖北,2022-12-19,浙江中控技术股份有限公司,1750000
中国地质大学（武汉）,中国地质大学（武汉）数字孪生校园中标公告,,湖北,2022-12-18,湖北瀚视智能科技有限公司,3189000
中国地质大学（武汉）,中国地质大学（武汉）“数智化实验中心集成系统”中标公告,限公司 核心产品名称：岩心钻机数字孪生系统 核心产品品牌：摩鸣科技 核,湖北,2022-12-17,武汉摩鸣科技有限公司,2596000
中国地质大学（武汉）,中国地质大学（武汉）钻进过程定向取心智能控制系统成交公告,：中国地质大学（武汉）深地钻进过程控制数字孪生产教融合实验设备成交公告,武汉,2022-12-12,中煤科工西安研究院（集团）有限公司,700000
中国地质大学（武汉）,中国地质大学（武汉）深地钻进过程控制数字孪生产教融合实验设备成交公告,,武汉,2022-12-12,中煤科工西安研究院（集团）有限公司,750000
中国地质大学（武汉）,中国地质大学（武汉）智慧模电实验平台成交公告,制数字孪生产教融合实验设备成交公告 下一篇：中国地质大学（武汉）实验室,武汉,2022-12-11,湖北鑫合欣科技有限公司,598500
中国地质大学（武汉）,国土碳汇数字孪生平台成交公告,,武汉,2022-12-5,北京创时空科技发展有限公司,740000
中国电建集团华东勘测设计研究院有限公司,兰江流域数字孪生应用物联感知成套供货与技,,江苏,2023-4-20,中国电信股份有限公司兰溪分公司,1750015
中国电力工程顾问集团西南电力设计院有限公司,[西南院]盘江新光2×66万千瓦燃煤发电项目数字孪生智能应用系统采购,,成都,2023-5-11,浪潮云信息技术股份公司,17287745
中国电力工程顾问集团西南电力设计院有限公司,[西南院]数字孪生平台一期（三维可视化模块）开发服务采购,,成都,2022-10-28,成都翔鑫科技有限公司,475000
中国电力科学研究院有限公司,成交结果公告-中国电力科学研究院有限公司2022年第十批服务类竞争性谈判采购（一）,22362113 特高压能耗及数字孪生系统测试服务 武汉理工大学 75,北京,2022-11-8,索维昆(北京)科技发展有限公司,0
中国电信股份有限公司北京分公司,北京市科委大运河文化复现课题项目大运河文化复现数字孪生系统（大运河文化（北京段）复现数字孪生系统课题研究）项目单一来源采购公示,,北京,2023-3-7,新国脉数字文化股份有限公司,0
中国电信股份有限公司甘肃分公司,2021-2022年甘肃电信云网大脑及数字孪生建设项目中标结果公示,,甘肃,2022-11-8,中电万维信息技术有限责任公司,0
中国电信股份有限公司湖北智能云网业务运营中心,中国电信股份有限公司湖北智能云网业务运营中心2023年中心数字孪生可视化支撑服务项目中选人公示,基于元宇宙开发中心虚拟监控大厅，打破物理空间局限，并同智慧运营大脑打通，建立中心线上第二监控现场建立中心云展厅，突破无物理空间展厅的限制，通过3D建模、虚拟漫游，实现中心历史沿革、党建统领、员工荣誉、数转创新等方面的云上虚拟展示。,湖北,2023-6-20,湖北省信产通信服务有限公司数字科技分公司,275000
中国电信股份有限公司晋江分公司,福建安能新材料股份有限公司5G双千兆智能工厂项目单一来源采购公示,碳排放管理系统、能耗管理系统、数字孪生、工业PON等等。总估算金额不超,福建,2023-6-9,中电福富信息科技有限公司,7796864
中国电信股份有限公司兰州分公司,兰州市城关区数字化城管平台升级改造项目（软件部分）数字孪生应用平台中标结果公示,,甘肃,2023-1-17,中星电子股份有限公司,0
中国电信股份有限公司宁德分公司,2023年中国电信宁德分公司寿宁文达镁铝软件项目单一来源采购公示,MS智能仓储系统 套 1 8 数字孪生平台（3D可视化） 套 1 软件,福建,2023-4-18,技发展有限公司,0
中国电信股份有限公司清远分公司,中国电信股份有限公司清远分公司政企信息化合作伙伴（解决方案类）2023年第二期公开招募结果公示,排名不分先后）： 清远维智星辰数字孪生智能科技有限公司、清远市智虎科技,广东,2023-3-17,清远维智星辰数字孪生智能科技有限公司,0
中国电信股份有限公司衢州分公司,衢江区人民法院大洲人民法庭信息化项目单一来源采购公示,传及数据驾驶仓 ㎡ 15 9 数字孪生法治指挥服务平台与无讼村建设指标,浙江,2023-3-21,衢州天恩电子科技有限公司,0
中国电信股份有限公司山东分公司,中国电信山东分公司2023年资源中心建设工程扩容项目单一来源采购公示,TELEPG数据库，落实集团对数字孪生和两级业务互联的建设要求。结合省,山东,2023-5-18,浩鲸云计算科技股份有限公司,0
中国电信股份有限公司上海分公司,2022年中国电信上海公司嘉定局数字孪生驾驶舱技术服务项目中选人公示,,上海,2022-12-1,上海弘盛信息科技有限公司,0
中国电信股份有限公司上海互联网,社区数字孪生应用开发项目的结果公示,,上海,2022-8-25,小神智能科技上海有限公司,0
中国电信股份有限公司上海金山电信局,中国电信上海公司金山局2022年金山化工区和碳谷绿湾园区数字底座项目中选人公示,司 否决参选情况：北京五一视界数字孪生科技股份有限公司因未提供营业执照,上海,2022-12-16,上海吉运软件技术股份有限公司,0
中国电信股份有限公司上海数字生活部,2023年青浦区重固镇福贸路幸福街区数字孪生项目,,上海,2023-3-16,小神智能科技上海有限公司,0
中国电信股份有限公司无锡分公司,中国电信股份有限公司无锡分公司无锡市新吴区企业数字化二期建设项目（二次）中选结果公示,业数字化二期建设项目（二次） 数字孪生（无锡）技术有限公司 1 （二）,无锡,2022-12-2,孪生（无锡）技术有限公司,0
中国电信股份有限公司浙江分公司,中国电信浙江公司2022年“数字孪生”省级体验厅联合体内容升级及赋能推广项目单一来源采购公示,,浙江,2022-8-31,【中通服慧展科技有限公司】,0
中国电信集团有限公司哈尔滨分公司,哈尔滨电信2023年数字孪生平台应用设计开发服务项目中选人公示,,黑龙江,2023-3-22,哈尔滨易呈科技有限公司,0
中国电子技术标准化研究院,中国电子技术标准化研究院DCS实体仿真工艺及数字孪生建设项目中标公告,,北京,2022-10-26,烽台科技（北京）有限公司,0
中国电子技术标准化研究院,中国电子技术标准化研究院典型行业工艺流程数字孪生体建设项目中标公告,,北京,2022-10-26,宁波和利时信息安全研究院有限公司,0
中国工商银行股份有限公司吉林省分行,吉林大学银校合作数字化高校建设项目数字孪生教学实验平台建设项目中标结果公告,,吉林,2023-3-16,吉视传媒信息服务有限责任公司,1371707
中国工业互联网研究院,中国工业互联网研究院工业互联网典型技术实训教学资源采购项目中标公告,业设备模组;教学仿真实训系统;数字孪生软件;数字孪生实体产线;工业互联,北京,2022-12-30,聊城莱柯智能机器人有限公司,2835600
中国广电四川网络股份有限公司都江堰市分公司,中国广电四川网络股份有限公司都江堰市分公司 三维城市数字孪生系统开发服务项目 询价结果公示,,成都,2023-1-11,都江堰城市大数据科技有限公司,0
中国航发哈尔滨东安发动机有限公司,机匣产品数字孪生装配检测单元中标公告,,哈尔滨,2023-1-4,中航国际航空发展有限公司,6990000
中国核电工程有限公司,数字孪生验证优化系统采购项目中标结果公告,,,2022-12-9,浙江大学滨江研究院,0
中国建设银行股份有限公司,中国建设银行股份有限公司数据管理与应用外部专家资源池采购项目中标公示,赛仕软件(北京)有限公司、厦门数字孪生信息科技有限公司、同盾科技有限公,北京,2023-1-4,北京数牍科技有限公司,0
中国建设银行股份有限公司,数据管理与应用外部专家资源池(数据分析与建模方向)中标公告,赛仕软件(北京)有限公司、厦门数字孪生信息科技有限公司、同盾科技有限公,北京,2023-1-4,上海估家网络科技有限公司,0
中国舰船研究设计中心,装备数字孪生及健康管理国内外技术发展研究项目中标结果公告,,海淀,2022-10-25,中国地质大学,0
中国舰船研究设计中心,大型舰船关键系统孪生体理论与外军数字孪生应用情报分析研究项目中标结果公告,,武汉,2022-10-25,地质大,0
中国交通信息科技集团有限公司,南沙首期建设项目数字孪生技术服务采购项目评标结果公示,,北京,2022-12-27,北京超图软件股份有限公司,16380000
中国科学院地质与地球物理研究所,中国科学院地质与地球物理研究所井场数字孪生仿真系统采购项目成交公告,,成都,2022-7-8,成都锦西数智科技有限公司,648000
中国空空导弹研究院,基于数字孪生的协同设计验证环境-结果公告,,洛阳,2022-8-1,北京华悦迈普科技有限公司,5890100
中国联合网络通信有限公司吉林省分公司,2023年长春联通基于数字孪生引擎的数字孪生工具链平台在通信网络资源管理领域的应用与示范委托开发单一来源采购需求公示,,长春,2023-4-14,联通数字科技有限公司吉林省分公司,0
中国联合网络通信有限公司威海市分公司,威海市水务局数字孪生黄垒河流域建设项目公开招标中标结果公告,,山东,2023-5-14,,2600
中国联合网络通信有限公司新疆维吾尔自治区分公司,2022年中国联通新疆分公司5G+AI数字孪生可视化创新平台一期研发采购项目（标段一）评审结果公示,,新疆,2023-3-2,新疆大学,0
中国联合网络通信有限公司新疆维吾尔自治区分公司,2022年中国联通新疆分公司5G+AI数字孪生可视化创新平台一期研发采购项目（标段二）评审结果公示,,新疆,2023-2-23,乌鲁木齐万和益华信息技术有限公司,0
中国联合网络通信有限公司研究院,2022年联通研究院自智网络研发与应用技术支撑服务转单一来源采购结果公示,商向高层次自智网络演进。并研发数字孪生模块，负责孪生体的模拟器开发，以,,2022-7-22,宜通世纪科技股份有限公司,0
中国煤矿机械装备有限责任公司本部,数字孪生系统|结果公示,,北京,2023-2-23,北京鼎视盛兴科技有限公司,0
中国煤矿机械装备有限责任公司本部,中天合创二期工作面数字孪生系统硬件及掘进工作面集控中心其他硬件结果公告,,北京,2023-2-23,北京同创蓝云科技有限公司,0
中国煤矿机械装备有限责任公司本部,大海则20201工作面机架式数字孪生系统主机结果公告,,北京,2022-8-31,北京瑞百川科贸有限公司,0
中国美术学院,浙江省国际技术设备招标有限公司关于中国美术学院数字孪生交互实验设备的成交结果公告,,杭州,2022-8-19,浙江效辕科技有限公司,191900
中国民生银行股份有限公司,中国民生银行股份有限公司信息科技部物联数智平台软件采购项目（包2：数字孪生及可视化软件采购）结果公示,,北京,2023-4-10,深圳华付技术股份有限公司,0
中国南水北调集团水网智慧科技有限公司,中国南水北调集团水网智慧科技有限公司数字孪生南水北调（惠南庄泵站）工程安全监测模型服务项目中标候...,,丰台,2023-2-28,,0
中国南水北调集团水网智慧科技有限公司,中国南水北调集团水网智慧科技有限公司数字孪生南水北调（惠南庄泵站）现地服务器及网闸采购项目中标候...,,丰台,2023-2-28,,0
中国南水北调集团水网智慧科技有限公司,数字孪生南水北调（惠南庄泵站）泵组声纹在线监测及数据分析项目结果公示,,丰台,2023-2-28,中水三立数据技术股份有限公司,0
中国南水北调集团水网智慧科技有限公司,数字孪生南水北调（惠南庄泵站）金属结构在线监测及数据分析项目结果公示,,丰台,2023-2-28,成都众柴科技有限公司,0
中国南水北调集团水网智慧科技有限公司,数字孪生南水北调（惠南庄泵站）设备综合风险分析及劣化分析模型服务项目结果公示,,丰台,2023-2-28,中水三立数据技术股份有限公司,0
中国南水北调集团水网智慧科技有限公司,数字孪生南水北调（惠南庄泵站）视频智能识别模型集成服务项目结果公示,,丰台,2023-2-28,中水三立数据技术股份有限公司,0
中国能源建设集团陕西省电力设计院有限公司,[陕西院]山南市森布日110千伏变电站10千伏送出工程配电网数字孪生可视化负荷管理系统招标采购项目,,陕西,2023-3-23,北京中电智博科技有限公司,4844975
中国人民解放军某部队,某数字孪生系统及虚拟信息库研制评标结果公示,,北京,2022-12-2,中科九度（北京）空间信息技术有限责任公司,0
中国商用飞机有限责任公司上海飞机设计研究院,面向创新应用场景的民机数字孪生系统建设-结果公告,,江苏,2023-5-18,江苏数伽科技有限公司,3496000
中国上海自由贸易试验区临港新片区管理委员会,临港新片区数字孪生城市建设可行性研究报告评估-临港新片区数字孪生城市建设可行性研究报告评估成交结果公告,,黄浦,2022-9-27,上海信息投资咨询有限公司,292900
