国网上海综合能源服务有限公司,国网上海综合能源服务有限公司2022年11月第一次授权采购项目中标结果公示,292.5 1 2 智能巡检数字孪生集成与交互辅助服务项目 云智慧（,奉贤,2022-12-11,云智慧(北京)科技有限公司,0
国网思极数字科技（北京）有限公司,国网信息通信产业集团有限公司2022年第十五次授权（非物资）公开竞争性谈判（思极数科）成交结果公告,-202215SQ-FF60 数字孪生能源互联网研究咨询服务 国网思极,北京,2022-12-19,广东铭太信息科技有限公司,0
国网思极位置服务有限公司,国网信息通信产业集团有限公司2022年第十次授权（非物资）公开竞争性谈判（福建地区）-位置 成交结果公告,FJ-FF43 GIS平台三维数字孪生实施服务 软通动力信息技术（集团,福建,2022-9-26,二十一世纪空间技术应用股份有限公司,0
国网信通亿力科技有限责任公司,国网信息通信产业集团有限公司2022年第十三次授权（非物资）公开竞争性谈判（福建地区）成交结果公告,02213SQFJ-FF02 数字孪生系统技术支持服务 国网信通亿力科,福建,2022-11-21,京德风新征程科技,0
国网信息通信产业集团有限公司,国网信息通信产业集团有限公司2023年第三次集中物资类采购公开竞争性谈判,TG-2023FW03-02 数字孪生实验室2023年软件购置 北京煜,南京,2023-5-12,北京东方恒视科技发展有限公司,0
国网信息通信产业集团有限公司,工业数字孪生可视化技术研究服务,,深圳,2022-12-5,深圳市共创智能科技有限公司,80000
国网信息通信产业集团有限公司,安徽继远软件有限公司2022年第十一次授权（非物资）公开竞争性谈判 成交结果公告,211-FF16 池州密集通道数字孪生实施服务 安徽继远软件有限公司,合肥,2022-10-24,安徽继远软件有限公司,0
国网信息通信产业集团有限公司,安徽继远软件有限公司2022年第十次授权（非物资）公开竞争性谈判 成交结果公告,210-FF08 安庆密集通道数字孪生实施服务 安徽继远软件有限公司,合肥,2022-9-28,安徽景路数据科技有限公司,0
国网信息通信产业集团有限公司,安徽继远软件有限公司2022年第九次授权（非物资）公开竞争性谈判 成交结果公告,209-FF30 六安密集通道数字孪生技术服务 安徽继远软件有限公司,合肥,2022-9-13,安徽全盟电力科技股份有限公司,0
国网信息通信产业集团有限公司,国网信息通信产业集团有限公司2022年第三次产业项目物资采购（产业基建、技改、大修）公开竞争性谈判-成交结果公告,TG-2022FW04-13 数字孪生实验室软件购置 北京煜邦电力技术,北京,2022-8-23,智瞻科技股份有限公司,0
国网信息通信产业集团有限公司北京分公司,国网信息通信产业集团有限公司2023年第二次授权（非物资）公开竞争性谈判（信产北京分公司）成交结果公告,-202302SQ-FF13 数字孪生数据中心可视化应用研发 国网信息,北京,2023-3-13,公司北京分公,0
国网信息通信产业集团有限公司信息通信共享服务分公司,国网信息通信产业集团有限公司2022年第十一次授权（非物资）公开竞争性谈判（信产ICT共享分公司）成交结果公告,-202211SQ-FF48 数字孪生平台应用设计开发服务 国网信息通,福建,2022-10-21,国网信息通信产业集团有限公司信息通信共享服务分公司,0
国有资产管理处,内蒙古化工职业学院基于VR与数字孪生的锅炉事故应急演练系统项目中标公告,,呼和浩特,2023-6-12,内蒙古元展科技有限公司,460000
哈尔滨电机厂有限责任公司,数字孪生硬件设备采购结果公示,,哈尔滨,2023-5-4,哈尔滨鑫聚生科技开发有限公司,0
哈尔滨电机厂有限责任公司,哈尔滨电机厂发电设备数字孪生智能运维系统定制开发(二次)中标结果公示,,哈尔滨,2022-8-23,北京智宇创亿科技有限公司,1860000
哈尔滨电气股份有限公司,数字孪生专项课题网络改造及网络安全设备采购项目（一期）中标结果公告,,哈尔滨,2023-5-18,哈尔滨金嵊坤朋科技有限公司,3876000
哈尔滨电气股份有限公司,数字孪生专项课题基础环境高性能计算中心二期建设中标结果公,,哈尔滨,2023-3-10,黑龙江溶鑫科技有限公司,8812900
哈尔滨电气股份有限公司,数字孪生管理系统及工业互联网平台升级基础环境项目中标结果公告,,哈尔滨,2023-2-16,中移系统集成有限公司,0
哈尔滨工程大学,哈尔滨工程大学工程系统设计与制造流程认知开源设计系统采购及服务项目成交结果公告,：244500.00元 名称：数字孪生工厂软件 品牌（如有）：芜湖安普,哈尔滨,2022-12-16,宁波摩科机器人科技有限公司,1092500
哈尔滨工程大学,哈尔滨工程大学工程系统设计与制造流程认知开源设计系统采购及服务成交公告,系统；总控系统；工业拼接大屏；数字孪生工厂软件； 宁波摩科；宁波摩科；,黑龙江,2022-12-16,宁波摩科机器人科技有限公司,1092500
哈尔滨工业大学,哈尔滨工业大学龙门式多机器人预制化建造平台（一期）中标结果公告,台 多机器人协同系统 智能制造数字孪生系统 库卡 库卡 博达特 博达特,黑龙江,2022-12-26,苏州博达特机电科技有限公司,3953800
哈尔滨工业大学,哈尔滨工业大学龙门式多机器人预制化建造平台（一期）中标结果公告,/KUKA.RoboTeam 1 125800 10 智能制造数字孪生,惠州,2022-12-26,苏州博达特机电科技有限公司,3953800
哈尔滨工业大学,哈尔滨工业大学城市灾情数字孪生系统平台采购成交结果公告,,哈尔滨,2022-11-23,北京云庐科技有限公司,972000
哈尔滨国贸城商贸有限责任公司,国贸城商场智慧安全用电管理平台,云平台定制化开发一、系统集成及数字孪生商业综合管理平台定制化开发二、主,哈尔滨,2022-12-19,黑龙江鑫世觉智能科技开发有限公司,2176258
哈尔滨理工大学,哈尔滨理工大学荣成校区机械工程智能制造实验实训平台建设项目结果公告,1-25 其他试验仪器及装置 数字孪生系统单元 维讯机器人 VR-TW,黑龙江,2022-9-29,杭州维讯机器人科技有限公司,2959000
哈工大机器人创新中心有限公司,虚拟仿真智慧工厂产线实训室项目-结果公告,YX-3 1 7000 27 数字孪生系统 哈尔滨兴盛自动化设备制造有,哈尔滨,2022-11-24,哈尔滨兴盛自动化设备制造有限公司,3013980
海南电网物资有限公司,海南电网有限责任公司2022年第一批科技项目公开竞争性谈判项目结果公告,与示范-课题1：热带海岛微电网数字孪生关键技术研究 武汉大学 5 3-,乌海,2022-8-5,,0
海洋石油工程股份有限公司,往复式天然气压缩机成套设备数字孪生技术研究中标结果公告,,北京,2022-11-14,中国石油大学(北京),618000
邯郸市漳滏河灌溉供水管理处,智慧水利数字孪生滏阳河工程中标结果公示,,邯郸,2022-12-22,中国水利水电科学研究院,44450880
邯黄铁路有限责任公司,邯黄铁路有限责任公司基于数字孪生和健康管理的地图式安全隐患监测识别系统研制（I期）中标结果公示,,河北,2023-3-13,天津华铁科为科技有限公司,1681000
杭州电子科技大学自动化学院,煤炭分质利用气化炉等数字孪生平台项目成交公告,,杭州,2023-4-4,杭州万维镜像科技有限公司,478000
杭州富阳城市建设投资集团有限公司,浙江建安工程管理有限公司关于秦望通道工程站城隧一体化火灾智慧防控与数字孪生运营关键技术及应用的成交公告,,杭州,2022-9-14,浙江大学,3060000
杭州高级中学钱塘学校,关于杭州高级中学钱塘学校配套信息化及专用教室设备（电子班牌二期、空天信特色教学空间）项目的中标(成交)结果公告[杭州市教育发展服务中心],信息 1 400800 3D 数字孪生校园建模 1 杭州高级中学钱塘学,杭州,2022-7-7,杭州晓雷科技有限公司,722100
杭州高级中学钱塘学校,杭州市教育发展服务中心关于杭州高级中学钱塘学校配套信息化及专用教室设备（电子班牌二期、空天信特色教学空间）项目的中标(成交)结果公告,3D 数字孪生校园建模 1 杭州高级中学钱塘学校配套信息化及专用教室设,杭州,2022-7-7,杭州晓雷科技有限公司,722100
杭州科技职业技术学院(杭州广播电视大学),浙江国际招投标有限公司关于大江东数字孪生与智慧楼宇系统中标(成交)结果公告,,浙江,2023-6-13,杭州路川信息技术有限公司,3209800
杭州市第三社会福利院,杭州市第三社会福利院智慧养老院数字孪生系统配套设备项目中标结果公告,,杭州,2022-8-31,杭州熠晨科技有限公司,224000
杭州市第三社会福利院,杭州市第三社会福利院数字孪生养老院二期建设开发项目中标结果公告,,杭州,2022-7-15,浙江九凌科技有限公司,298738
杭州市富阳区农业农村局,中标公示,中标公示 数字孪生皇天畈流域构建框架及建设标准研究项目招标活动于202,杭州,2023-3-12,浙江水利水电学院,318000
杭州市富阳区胥口镇人民政府,胥口镇里坞村标杆点数字化应用建设项目,化应用建设项目 葛洪丹谷3D 数字孪生沙 盘资源云管 理平台 华数 1,杭州,2022-9-5,杭州富阳华数数字电视有限公司,1861860
杭州市规划和自然资源局临安分局,临安区地质灾害观测基地建设项目,地质灾害风险防控试点和地质灾害数字孪生等一系列成果基础上，在临安区天目,杭州,2022-12-21,浙江省工程物探勘察设计院有限公司,3758500
杭州市林业水利局,浙江中诺招标代理有限公司关于杭州市林业水利局数字孪生分水江流域试点项目监理服务的竞争性磋商结果公告,,杭州,2023-6-21,杭州平勤信息工程咨询有限公司,60000
杭州市西湖区农业农村局,西湖区水利设施视频监控租赁服务,准化管理平台、之江区域智慧水利数字孪生系统，集成统一管控。另外，新建点,杭州,2022-9-30,浙江东创高科电气有限公司,1461920
杭州萧山技师学院,杭州萧山技师学院智能制造单元数字孪生实训系统（40节点）政府采购项目,,杭州,2023-5-17,深圳市华兴鼎盛科技有限公司,837200
杭州萧山技师学院,浙江华耀建设咨询有限公司关于杭州萧山技师学院智能制造单元数字孪生实训系统（40节点）政府采购项目的中标(成交)结果公告,,杭州,2023-5-17,,0
航空科学与工程学院,航空科学与工程学院结构数字孪生连接结构预紧力监测仪器竞价结果公示,,北京,2022-12-7,北京艾法斯特科技发展有限公司,200000
航空科学与工程学院,航空科学与工程学院结构数字孪生光纤监测仪器竞价结果公示,,北京,2022-12-7,四川犀准科技有限公司,400000
航空科学与工程学院,航空科学与工程学院结构数字孪生小型结构试验台竞价结果公示,,北京,2022-12-7,天津航钛科技有限公司,500000
航空科学与工程学院,航空科学与工程学院结构数字孪生涡流无损检测仪器竞价结果公示,,北京,2022-12-7,四川犀准科技有限公司,200000
航空科学与工程学院,航空科学与工程学院结构数字孪生典型结构试件竞价结果公示,,北京,2022-12-7,天津玉涛航空制造有限公司,150000
航空科学与工程学院,航空科学与工程学院结构数字孪生压电导波监测仪器竞价结果公示,,北京,2022-12-7,成都信息工程大学,500000
航天万源云数据河北有限公司,景区数字孪生系统项目中标公告,,唐山,2022-11-4,中国移动通信集团河北有限公司唐山分公司,3150000
合肥北城新兴产业发展有限公司,长丰县区域工业互联网平台项目单一来源采购论证公示单一来源公示,I能力平台、支持企业灵活调用的数字孪生能力引擎和即搭即用的企业BI驾驶,合肥,2022-11-8,科大讯飞股份有限公司,0
和静县文化体育广播电视和旅游局,丰汇国际项目管理有限公司关于巴州和静县创建全域旅游示范区基础设施建设项目-景区数字化旅游项目的中标公告,旅大数据中心平台、全域智慧文旅数字孪生管理平台、全域智慧文旅公共公共服,新疆,2022-12-2,大象云智数据运营有限公司,21816613
和龙市农业农村局,和龙市农业农村局和龙数字乡村特色产业融合发展建设项目中标公告,信息技术有限公司 和龙数字乡村数字孪生一张图 吉科软 V1.0 1 1,吉林,2022-12-22,吉林省吉科软信息技术有限公司,38980643
和龙市头道镇人民政府,和龙数字乡村特色产业融合发展建设项目中标公示,信息技术有限公司 和龙数字乡村数字孪生一张图 吉科软 V1.0 1 1,延边,2022-12-22,吉林省吉科软信息技术有限公司,38980643
和田乌鲁瓦提水力发电厂,数字孪生乌鲁瓦提水利枢纽（2023年上半年）调度会商中心建设项目[中标公示],,和田,2023-4-27,宁夏水投云澜科技股份有限公司,2607860
和田乌鲁瓦提水力发电厂,数字孪生乌鲁瓦提水利枢纽（2023年上半年）数据底板及BIM建设项目[中标公示],,和田,2023-4-24,中水北方勘测设计研究有限责任公司,2730000
河北工业大学,河北工业大学河北工业大学智慧化工程体验中心建设项目（贴息贷款）竞争性磋商中标公告,深圳市博科系统科技有限公司 数字孪生平台（含软硬件）等 博科系统 B,河北,2022-12-25,江苏神州舜尧智能科技有限公司,0
河北工业大学,河北工业大学河北工业大学智慧化工程体验中心建设项目（贴息贷款...,深圳市博科系统科技有限公司 数字孪生平台（含软硬件）等 博科系统 B,天津,2022-12-25,江苏神州舜尧智能科技有限公司,0
河北工业大学,河北工业大学经管学院实验教学平台购置项目（贴息贷款）竞争性磋商中标公告,股份有限公司 BIM+智慧工地数字孪生沙盘（等）（其他信息详见附件）,河北,2022-12-22,第一包：天津科雷迅科技发展有限公司,729100
河北工业大学,河北工业大学经管学院实验教学平台购置项目（贴息贷款）竞争性磋商中标公告,股份有限公司 BIM+智慧工地数字孪生沙盘（等）（其他信息详见附件）,河北,2022-12-22,第五包:天津禄焱科技发展有限公司,0
河北工业职业技术大学,河北工业职业技术学院工业4.0技术应用系统、工业数字孪生系统项目中标结果公告,,石家庄,2023-3-17,山东栋梁科技设备有限公司,2196200
河北工业职业技术大学,智慧建造数字孪生实训室项目中标公告,,石家庄,2023-3-16,河北云在信息技术服务有限公司,3359780
河北工业职业技术大学,智慧建造数字孪生实训室项目中标公告,,石家庄,2023-3-16,河北云在信息技术服务有限公司,3359780
河北机电职业技术学院,河北机电职业技术学院第二批设备更新改造项目（贴息贷款）中标（成交）结果公告,联想教育科技（北京）有限公司 数字孪生可视化系统 优锘数字孪生实训平台,河北,2022-12-28,联想教育科技（北京）有限公司,11980000
河北机电职业技术学院,河北机电职业技术学院第二批设备更新改造项目（贴息贷款）中标（成交）结果公告,联想教育科技（北京）有限公司 数字孪生可视化系统 优锘数字孪生实训平台,河北,2022-12-28,联想教育科技(北京)有限公司,11980000
河北机电职业技术学院,Z1300002232301301河北机电职业技术学院第二批设备更新改造项目（贴息贷款）竞争性磋商结果公告,232301301-6 名称：数字孪生可视化系统 品牌：优锘数字孪生实,石家庄,2022-12-27,联想教育科技（北京）有限公司,11980000
河北机电职业技术学院,河北机电职业技术学院设备更新改造等项目（贴息贷款）一标段中标公告,、主要标的信息 货物类 名称：数字孪生基础教学实训台、管控一体化 ME,邢台,2022-12-22,北京华航唯实机器人科技股份有限公司,4681220
河北机电职业技术学院,河北机电职业技术学院设备更新改造等项目（贴息贷款）二标段中标公告,：工业机器人技术实训设备、工业数字孪生实训台等 品牌：中德栋梁、中德栋,邢台,2022-12-22,山东栋梁科技设备有限公司,2653600
河北机电职业技术学院,河北机电职业技术学院设备更新改造等项目（贴息贷款）二标段中标公告,工业机器人技术实训设备、工业数字孪生实训台等 中德栋梁、中德栋梁 D,邢台,2022-12-21,山东栋梁科技设备有限公司,2653600
河北机电职业技术学院,河北机电职业技术学院设备更新改造等项目（贴息贷款）一标段中标公告,航唯实机器人科技股份有限公司 数字孪生基础教学实训台、管控一体化 ME,邢台,2022-12-21,北京华航唯实机器人科技股份有限公司,4681220
河北省科学院应用数学研究所,河北省科学院应用数学研究所数字孪生交通仿真平台成交公告,,石家庄,2023-6-19,中国移动通信集团河北有限公司,584900
河北省水务中心,数字孪生黄壁庄水库工程建设先行先试项目中标结果公告,,河北,2023-5-26,浙江贵仁信息科技股份有限公司,5518849
河南黄河河务局信息中心,河南黄河河务局信息中心2022年河南黄河信息化建设项目马渡工程数字孪生试点成交公告,,河南,2022-12-1,河南环宇通信工程有限公司,497800
河南科技大学,河南科技大学高端装备科研创新团队建设设备及软件项目（四次）（第1包）-成交公告,有）规格型号数量单价1数控加工数字孪生软件系统西门子MCS4250F/,洛阳,2023-5-9,湖北鼎信力创工业科技有限公司,494500
河南科技大学,河南科技大学高端装备科研创新团队建设设备及软件项目（四次）（第1包）-成交公告,型号 数量 单价 1 数控加工数字孪生软件系统 西门子 MCS4250,河南,2023-3-27,湖北鼎信力创工业科技有限公司,494500
河南省省直机关综合办公楼管理中心,河南省省直机关综合办公楼网络中心系统集成维保项目成交公告,、登记管理系统、动环监控系统、数字孪生系统（在建）、安消系统（在建）等,郑州,2022-10-8,中科九州科技股份有限公司,497600
河南省豫资保障房管理运营有限公司,龙湖金融中心C4-09号楼数字孪生楼宇建设项目中标结果公告,,郑州,2022-10-24,杭州宇泛智能科技有限公司,9787867
河南豫资绿色生活产业发展有限公司,朱仙镇正向BIM和数字孪生项目-结果公告,,开封,2023-6-16,河南省联合旅游产业发展有限公司,10860000
贺州市平桂区投资促进服务中心,广西宏远工程项目管理有限公司关于贺州市平桂区招商辅助数字孪生平台建设项目的成交公告,,贺州,2023-3-29,壹瞰数字科技广西有限公司,977500
贺州市平桂区投资促进服务中心,广西宏远工程项目管理有限公司关于贺州市平桂区招商辅助数字孪生平台建设项目的成交公告,,贺州,2023-3-29,壹瞰数字科技广西有限公司,977500
贺州市平桂区投资促进服务中心,贺州市平桂区投资促进服务中心贺州市平桂区招商辅助数字孪生平台建设项目成交公告,,广西,2023-3-29,壹瞰数字科技广西有限公司,977500
鹤岗市关门嘴子水库开发建设管理局,鹤岗市关门嘴子水库工程数字孪生先行先试建设项目,,鹤岗,2023-4-3,黑龙江省水利水电勘测设计研究院,19800000
黑龙江省水利水电勘测设计研究院,大型水库工程数字孪生建设项目业务应用开发服务项目中标公示,,黑龙江,2023-6-2,松辽水利委员会水文局信息中心,7721400
黑龙江职业学院,黑龙江职业学院专业虚拟仿真实训中心—智慧工厂仿真实训室（智能）结果公告,00 1-27 行业应用软件 数字孪生系统 领智 LZ-ZJRJ-01,哈尔滨,2022-11-7,哈工大机器人创新中心有限公司,3997750
红塔烟草集团有限责任公司大理卷烟厂,2022年复烤片区数字工厂智能管控可视化平台的搭建与应用探索-中标人确认单公告,果公示如下： 一标段：复烤片区数字孪生工厂可视化平台 中标人单位名称：,大理,2022-9-19,,0
红塔烟草集团有限责任公司大理卷烟厂,红塔烟草（集团）有限责任公司大理卷烟厂2022年复烤片区数字工厂智能管控可视化平台的搭建与应用探索中标结果公示,果公示如下： 一标段：复烤片区数字孪生工厂可视化平台 中标人单位名称：,大理,2022-9-19,杭州安脉盛智能技术有限公司,0
红塔烟草集团有限责任公司大理卷烟厂,红塔烟草（集团）有限责任公司大理卷烟厂2022年复烤片区数字工厂智能管控可视化平台的搭建与应用探索中标候选人公示,、评审结果： 一标段：复烤片区数字孪生工厂可视化平台 第一中标候选人：,大理,2022-9-8,杭州安脉盛智能技术有限公司,1870900
湖北工业大学,湖北工业大学机器人数字孪生系统中标(成交)结果公告,,武汉,2023-5-6,武汉佳光鑫晨机电工程有限公司,2088000
湖北工业大学,湖北工业大学机器人数字孪生系统采购项目竞争性磋商公告成交公告,,湖北,2023-2-13,武汉佳光鑫晨机电工程有限公司,2088000
湖北工业大学,机器人数字孪生系统成交公告,,武汉,2023-2-13,武汉佳光鑫晨机电工程有限公司,2088000
湖北工业大学,湖北工业大学元宇宙工厂采购中标结果公告,、触控一体工作站、智能制造工厂数字孪生软件、HTC VIVE PRO,武汉,2022-8-25,湖北朗祺视讯科技有限公司,3286200
湖北国际物流机场有限公司,“智慧机场”关键技术研发类专利导航服务及知识产权贯标咨询辅导服务 采购项目成交结果公告,内容： （1）根据鄂州花湖机场数字孪生、无人驾驶等“智慧机场”相关技术,鄂州,2022-7-12,天启黑马信息科技武汉有限公司,350000
湖北交投京港澳高速公路改扩建项目管理有限公司,京港澳高速公路湖北境鄂豫界至军山段改扩建工程公路工程工业化智慧建造关键技术及产业化研究揭榜挂帅科技项目招标JBGS-1标段评标结果公示,范; 3、基于 BIM 的安全数字孪生工地关键技术研究; 4、千吨级梁,武汉,2023-4-23,华中科技大学,3440000
湖北科技学院,无人机智慧医疗与视觉识别综合实训基地建设第一期竞争性磋商成交公告,0 1 98000 3 可视化数字孪生系统 远洋智慧K1.0 1 80,咸宁,2023-1-11,远洋智慧科技天津有限公司,295000
湖北美的洗衣机有限公司,湖北美的洗衣机有限公司 23年-荆州基地-23内-洗荆-生产-SC12-滚筒专项-数字孪生项目 拟中标结果公示,园区智慧安全环保项目,荆州,2023-6-15,美云智数科技有限公司,835000
湖北省汉江兴隆水利枢纽管理局,数字孪生汉江兴隆水利枢纽工程建设先行先试数字孪生汉江兴隆水利枢纽工程建设先行先试设计采购施工总承包（EPC）中标结果公告,,武汉,2022-12-21,湖北省水利水电规划勘测设计院、钛能科技股份有限公司、长江勘测规划设计研究有限责任公司、阿里云计算有限公司,34912205
湖北省水利厅,湖北省数字孪生流域建设方案成交结果公告,,武汉,2023-5-16,湖北省水利水电规划勘测设计院有限公司,698600
湖北省王英水库管理局,湖北省王英水库管理局信息化项目（数字孪生王英水库）中标(成交)结果公告,,黄冈,2023-2-28,武汉中地数字孪生技术有限公司,386000
湖北省无线电监测中心,湖北省无线电监测中心课题研究项目采购成交结果公告,：武汉科技大学 基于无人机采用数字孪生技术实现无线电监测可视化展示及实,武汉,2023-4-4,第1包:华中科技大学,0
湖北省自然资源厅信息中心,基于数字孪生的地下空间资源评价模型与方法研究成交结果公告,,武汉,2023-5-23,中国地质大学（武汉）,199490
湖北水翼信息技术有限公司,湖北水翼信息技术有限公司询价结果公告,化改造工程“十四五”信息化项目数字孪生仿真平台和数据中台产品 二、询价,武汉,2023-4-25,软通智慧科技技术有限公司,0
湖南省江垭和皂市水库管理处,数字孪生江垭皂市工程库区管理部分第一期实施项目,,武汉,2022-10-28,长江水利委员会长江科学院,454335
湖南省欧阳海灌区水利水电工程管理局,欧阳海灌区防汛抗旱调度中心数字孪生支撑系统成交结果公告,,湖南,2022-11-29,陕西中盛睿达信息技术有限公司,1906000
湖南省欧阳海灌区水利水电工程管理局,湖南省欧阳海灌区水利水电工程管理局欧阳海灌区防汛抗旱调度中心数字孪生支撑系统竞争性磋商成交公告,,湖南,2022-10-31,陕西中盛睿达信息技术有限公司,1906000
湖州市公安局南浔区分局,浙江求真工程管理咨询有限公司关于湖州市公安局南浔区分局实景数字孪生智慧警务平台项目的中标(成交)结果公告,,湖州,2022-12-1,,0
