青海黄河上游水电开发有限责任公司,5G+数字孪生流域关键技术研究及应用中榜公示,,青海,2023-6-12,中国电建集团西北勘测设计研究院,0
青海交通职业技术学院,陕西开源招标有限公司关于青海交通职业技术学院车路协同虚拟仿真实训基地-车路协同虚拟仿真实训中心（数字孪生模块）建设项目的中标(成交)结果公告,,西宁,2022-9-21,大连泽软信息技术有限公司,639000
青海省水利厅信息中心,数字孪生湟水河试点建设项目可行性研究报告及初步设计成交结果公告,,西宁,2022-11-29,甘肃省水利水电勘测设计研究院有限责任公司,800000
清华大学,清华大学能源系统数字孪生开发平台中标结果公告,,北京,2022-12-23,北京象新力科技有限公司,4839900
清华大学,清华大学工业数字化设计混合现实定制系统购置项目,s2 20套 29800 2 数字孪生系统升级-1 微软 Holole,海淀,2022-12-21,北京国力中自科技有限公司,894000
清华大学,清华大学DNC沈机数字机床控制协作系统成交公告,、智能语音交互与知识图谱系统、数字孪生等技术内容。 合同签订开始3年,北京,2022-12-13,通用技术集团数字智能科技有限公司,1480000
清华大学,数字孪生系统升级-2（清设比选20222442号）成交结果公告,,北京,2022-11-20,上海凝丰智能科技有限公司,0
清华大学,MR数字孪生建筑教学平台软硬件（清设比选20221928号）成交结果公告,,北京,2022-11-1,厦门仁优网络科技有限公司,0
清华大学,清华大学901堆本体数字孪生系统及退役工程验证平台购置项目中标公告,,海淀,2022-7-29,中核武汉核电运行技术股份有限公司,14653816
清华大学深圳国际研究生院,三维数字孪生设备管理平台软件服务项目中标（成交）结果公示,,深圳,2023-1-5,上海卓宇信息技术有限公司,920000
清远职业技术学院,智能制造数字孪生实训室采购项目中标（成交）结果公告,,广州,2023-1-5,广州高谱技术有限公司,2498500
区城市网格化综合管理中心（区行政服务中心）,上海市徐汇区政府采购中心——徐汇区城市网格化综合管理中心三维数字孪生底座试点建设的中标（成交）结果公告,,徐汇,2022-11-15,上海市测绘院,9924400
泉州市洛江区农业农村和水务局,泉州市洛江区洛阳江数字孪生流域平台建设项目结果公告（合同包1）,,泉州,2023-2-23,海丝埃睿迪数字科技有限公司,3520000
润联智能科技股份有限公司,润联智能科技股份有限公司2022年化学材料珠海基地工业互联网平台推广项目-数字孪生采购中标结果公告,,珠海,2022-10-26,上海数映科技有限公司,1353480
三峡大学,（转载）三峡大学水环学院智慧水利流域数字孪生实验室建设中标(成交)结果公告,,宜昌,2022-12-23,北京浩宇天地测绘科技发展有限公司,2891000
三峡大学,（转载）三峡大学智能制造中心建设项目中标结果公告,30000 核心产品：智能制造数字孪生综合模拟平台 定制 华中数控/武,武汉,2022-12-23,武汉格瑞德科技有限公司,0
三峡大学,三峡大学三峡大学双创学院智能制造中心建设项目包一中标结果公告,万元) 货物类 名称：智能制造数字孪生综合模拟平台 品牌（如有）：华中,武汉,2022-12-23,武汉华中数控股份有限公司,16830000
三峡大学,三峡大学水环学院智慧水利流域数字孪生实验室建设中标(成交)结果公告,,宜昌,2022-12-23,北京浩宇天地测绘科技发展有限公司,2891000
三峡大学,三峡大学机动学院数字孪生创新设计实验室建设中标结果公告,,湖北,2022-12-22,深圳市筋斗云在线科技有限公司,4625000
三峡大学,（转载）三峡大学机动学院数字孪生场景应用实验室建设成交结果公告,,宜昌,2022-12-16,湖北泽一智能科技有限公司,1228000
三峡大学,三峡大学三峡大学机动学院数字孪生场景应用实验室建设中标(成交)结果公告,,宜昌,2022-12-16,湖北泽一智能科技有限公司,1228000
厦门大数据有限公司,公物投资-公开招标-GT2023-QY055-数字孪生东西溪-中标结果公示,,福建,2023-4-7,武汉虹信技术服务有限责任公司、中国水利水电科学研究院(联合体),9653754
厦门鹭城巴士集团有限公司,厦门万翔-公开招标-XM2022-TZ0658城市级车路协同数字化智慧出行示范平台基础设施路侧设备结果公示,货、安装、调试和运维管理平台及数字孪生服务上线（含与路云平台、应用平台,厦门,2022-12-26,厦门路桥信息股份有限公司,37885134
厦门市同安职业技术学校,智慧型老年照护虚拟仿真实训基地建设项目,建设基于数字孪生技术的老年照护综合置管智能示教设备系统、示教投屏系统等,厦门,2022-12-1,深圳妙创医学技术有限公司,1058000
山东城市建设职业学院,山东城市建设职业学院数字孪生城市实训室（坝道工程医院）项目中标（成交）公告,,济南,2022-10-24,山东中关创业信息科技股份有限公司,889000
山东大学,山东大学流程型智能制造及数字孪生可视化系统采购项目成交公告,,山东,2023-1-18,南通铂拓实验设备有限公司,1675600
山东大学,山东大学流程型智能制造及数字孪生可视化系统采购项目竞争性磋商成交公告,,山东,2023-1-18,南通铂拓实验设备有限公司,1675600
山东电工电气集团有限公司物资分公司,山东电工电气集团有限公司2022年北京富达第十二次生产经营性物资公开竞争性谈判采购,京迪锐领航科技有限公司 20 数字孪生三维底座升级服务 天津东和易联科,北京,2022-11-17,江苏翰林正川工程技术有限公司,0
山东电工电气集团有限公司物资分公司,山东电工电气集团有限公司2022年北京富达第九次生产经营性物资公开竞争性谈判采购-成交结果公告,有限公司 7 变电站、电缆线路数字孪生系统建模服务 北京天成易合科技有,北京,2022-9-21,北京麦格天宝科技股份有限公司,0
山东港口科技集团青岛有限公司,山东港口科技集团青岛有限公司东营港联化三维数字孪生采购项目,,青岛,2023-4-3,武汉众智鸿图科技有限公司,980000
山东港口科技集团日照有限公司,山东港口科技集团日照有限公司智慧粮食平台数字孪生可视化系统项目,,青岛,2022-9-13,河北光之翼信息技术股份有限公司,170000
山东港口科技集团有限公司,山东港口科技集团软件开发劳务外包-数字孪生方向入围项目,,青岛,2023-5-8,青岛海联软件科技有限公司,0
山东黄河河务局山东黄河信息中心,山东黄河河务局山东黄河信息中心山东黄河治理保护信息化平台优化升级项目中标公告,大数据中心提升、AI中枢提升、数字孪生平台提升、水旱灾害防御平台提升、,山东,2023-5-11,世方信息技术集团有限公司,779800
山东交通学院招标单位,山东高速股份有限公司2022年运营研发课题项目（标段1）中标结果公告,路网视角下基于多维用户需求动态数字孪生的高速精准化运营关键技术研究 中,山东,2022-7-4,山东交通学院,1036000
山东浪潮创新创业科技有限公司,基于机器振动的造纸设备健康管理系统-数字孪生采购中标结果公示_FWXM202212280005001,,山东,2023-1-10,华源创世工业智能科技有限公司,0
山东三木众合信息科技股份有限公司,山东三木众合信息科技股份有限公司数字孪生城市运行管理服务指挥平台升级改造项目中标公告,,山东,2023-2-21,中国移动通信集团山东有限公司,6740000
山东商业职业技术学院,山东商业职业技术学院科研处数字孪生研究基地建设项目中标（成交）公告,,济南,2022-11-24,广联达科技股份有限公司,697600
山东商业职业技术学院,山东商业职业技术学院科研处数字孪生研究基地建设项目中标（成交）公告,,济南,2022-10-18,北京华科软通科技有限公司,1245800
山东省调水工程运行维护中心,数字孪生胶东调水先行先试项目评标结果公示,,山东,2023-4-4,山东省水利勘测设计院有限公司,71777700
山东省水利勘测设计院有限公司,山东省水利勘测设计院有限公司数字孪生胶东调水工程先行先试,"深化设计、数字孪生平台、信息基础设施、网络安全体系、业务应用系统、标准规范体系、共建共享和系统接口与集成，以及其配套的安装、调试、联网调试等服务内容,以及包括设计联络会、过程验收、子系统验收、合同完工验收、试运行、质保、故障响应、技术支持、技术培训、运行维护等技术服务内容",济南,12小时前,山东鼎际信息技术有限公司,71777700
山东省水利勘测设计院有限公司,山东省水利勘测设计院有限公司数字孪生泵站WEBGL三维开发技术服务成交结果公示,,济南,2022-12-6,山东川和信息科技有限公司,463000
山东省水利综合事业服务中心,山东省“金水工程”2020年建设项目中标（成交）公告,目的资源共享交换，以山东省水利数字孪生共享交换平台整合省内数字孪生项目,济南,2022-12-2,山东锋士信息技术有限公司,2380000
山东省淄博市工业学校,智能装备数字孪生虚拟调试实训室建设（虚拟仿真实训基地）建设控制仿真工作站,,淄博,2022-9-28,淄博市临淄慧聪信诺商贸有限公司,798500
山东省淄博市工业学校,[山东省·淄博市·临淄区][竞争性磋商]山东省淄博市工业学校 高水平中等职业学校（虚拟仿真实训基地）建设控制仿真工作站、智能装备数字孪生虚拟调试实训室建设项目,,淄博,2022-9-28,淄博市临淄慧聪信诺商贸有限公司,798500
山东信息职业技术学院,聊城市彭楼灌区十四五续建配套与现代化改造工程设计中标公示,标的信息： 标包：A1 名称：数字孪生应用与实训系统 品牌（如有）：详,聊城,2022-10-24,山东跃骏智能科技有限公司,226500
山东信息职业技术学院,山东信息职业技术学院数字孪生应用与实训系统采购项目中标（成交）公告,,潍坊,2022-10-19,山东跃骏智能科技有限公司,226500
山东信息职业技术学院,山东信息职业技术学院智能制造系统（MES）实施与应用数字孪生实训室建设项目中标（成交）公告,,潍坊,2022-10-13,上海明材数字科技有限公司,828000
山河智能装备股份有限公司,山河智能旋挖钻机数字孪生建模及可视化平台界面设计项目评标结果公告,,上海,2023-4-28,深圳十沣科技有限公司,0
山西大学,山西大学能量管理平台和仿真系统采购的结果公告,540272F 2 风光储微网数字孪生能量管理平台 1 套 18800,太原,2022-12-11,西安越众软件科技有限公司,0
山西机电职业技术学院,山西机电职业技术学院公开招标山西机电职业技术学院智能制造实训基地教学设备（一期）采购项目的结果公告,al compo nents 数字孪生功能 模块软件 2 山西机电职业,长治,2022-12-8,亚龙智能装备集团股份有限公司,8999900
山西路桥集团交通产业开发有限公司,山西路桥集团交通产业开发有限公司智慧工地数字孪生应用系统技术服务直接采购结果公示,,山西,2022-12-13,山西虚拟现实产业技术研究院有限公司,0
山西省畜牧兽医学校,山西省畜牧兽医学校无人机实训室建设项目的结果公告,兽医学校无人机实训室建设项目 数字孪生 3D智能虚拟实训室系统（含文化,太原,2022-9-9,远洋智慧科技天津有限公司,897900
山西省水利发展中心,小流域水土保持数字孪生的结果公告,,太原,2023-5-19,山西汇泽源水利工程咨询有限公司,1798750
山西省水利发展中心,水利信息化技术支撑工作经费成交公告,利信息化技术支撑工作经费 水利数字孪生体系建设及仿真技术能力提升 1,太原,2022-8-26,太原理工大学,298000
山西省水利发展中心,数字孪生技术灌区智慧调度示范研究成交公告,,太原,2022-8-25,山西水务科技有限公司,1042000
山西职业技术学院,山西职业技术学院竞争性磋商智能控制数字孪生仿真实训室的结果公告,,太原,2022-12-13,山东栋梁科技设备有限公司,498750
山西职业技术学院,山西职业技术学院公开招标山西职业技术学院智能制造公共实训基地设备采购项目的结果公告,含一套智能制造生产线及智能产线数字孪生虚拟调试终端。智能制造综合实训生,山西,2022-12-7,上海景格科技股份有限公司,6958000
陕西工业职业技术学院,陕西工业职业技术学院虚拟仿真实训项目建设(二次)中标（成交）结果公告,额（万元） 收取对象 2 模具数字孪生虚拟仿真实训项目 0.8955,陕西,2022-9-26,深圳模德宝科技有限公司,1500000
陕西宏远航空锻造有限责任公司,数控采集与监控系统、厂房能源管理系统、车间生产数字孪生系统、视频生产监控系统、数字化车间综合运营管控平台(一期)、生产制造执行系统(一期)、车间信息化设备中标公告,,西安,2022-12-30,西安未来国际信息股份有限公司,5796000
陕西科技大学,陕西科技大学智能制造产线（复杂型面智能加工单元）采购项目中标（成交）结果公告,五轴加工中心、工业互联MES及数字孪生可视化系统等 GF、微茗 MIL,西安,2022-12-25,诺浩智造(北京)科技有限公司,6100000
陕西省水利厅机关,陕西水网规划中标（成交）结果公告,复体系。结合水网建设要求，利用数字孪生、模拟仿真等新技术，构建陕西水网,陕西,2022-11-4,陕西省水利电力勘测设计研究院,19850000
汕头大学,汕头大学机械工程系教学实验设备采购项目结果公告,智能控制技术工程实训系统（含数字孪生软件） 莱茵 RK-SM-015,汕头,2022-12-19,江苏东华测试技术股份有限公司,895385
上海宸深置业有限公司,自贸区临港新片区PDC1-0302单元05-05地块项目数字孪生平台及BIM运维系统邀请函,,深圳,2022-11-11,,0
上海大学,上海大学工业物联数字孪生教学实训系统项目的中标（成交）结果公告,,闵行,2022-8-31,上海先铂科技有限公司,2060000
上海第二工业大学,上海第二工业大学智能工厂数字孪生及数据三维可视化教学软件采购成交公告,,上海,2022-12-2,上海浦成机电设,309000
上海第二工业大学,上海市政府采购中心第2022-09-184号信息-上海第二工业大学数字孪生服务器成交公告,,上海,2022-10-14,上海奋信软件信息技术有限公司,98000
上海电机学院,上海电机学院MPS实训室建设项目中标公告,,上海,2023-5-26,上海质木自动化技术有限公司,803680
上海工艺美术职业学院,上海工艺美术职业学院传统手工艺非遗数字化保护中心三维采集服务项目成交公告,心三维采集服务 部分经典作品的数字孪生基础数据构建 根据“手工艺非遗图,上海,2022-8-15,三的部落（上海）科技股份有限公司,146500
上海恒能泰企业管理有限公司瑞永设计策划分公司,数字孪生配电网规范研究的技术服务采购（流标重招）成交结果公告,,上海,2022-10-20,上海同鹰实业有限公司,0
上海建工集团股份有限公司,126省道南京段改扩建工程（大周路至苏皖省界段）S126JN-SG2标智慧工地建设（数字化传递）中标结果公示,撑。 c）软件著作权2项 根据数字孪生应用开发内容申请相应的软件著作权,南京,2023-6-7,北京云星宇交通科技股份有限公司,0
上海交通大学医学院附属瑞金医院,上海交通大学医学院附属瑞金医院智慧后勤管控改造项目的中标（成交）结果公告,1558008.00 提供智慧数字孪生管控平台，包含环境空间：全员可视,上海,2022-9-5,北京泰豪智能工程有限公司,15580008
上海科技馆,上海科技馆展览实景交互科普游戏《消失的科博士》线上元宇宙版本研发成交公告,消失的科博士》元宇宙版本，建设数字孪生上海科技馆。 详见采购文件 合同,上海,2023-5-12,上海复旦上科多媒体股份有限公司,278000
上海申康医院发展中心,支撑平急结合的市级医院急危重症救治数字孪生平台（一期）项目的中标（成交）结果公告,,上海,2023-5-11,蓝想大数据科技(上海)有限公司,25166700
上海申康医院发展中心,上海上投招标有限公司关于上海申康医院发展中心支撑平急结合的市级医院急危重症救治数字孪生平台（一期）建设项目成交公告,,上海,2023-3-16,上海鹏安数通管理咨询有限公司,0
上海市宝山区教育学院,宝山区元宇宙数字孪生校园建设项目成交公告,,宝山,2022-12-9,上海华渔计算机软件有限公司,865000
上海市崇明区东平镇人民政府,上海市崇明区东平镇人民政府东平镇数字孪生管理平台项目的中标（成交）结果公告,,上海,2022-12-16,上海米可维大数据科技有限公司,3350000
上海市大数据中心,数字孪生黄浦江子系统建设项目的中标（成交）结果公告,,黄浦,2023-5-11,黄河勘测规划设计研究院有限公司,8600000
上海市大数据中心,数字孪生黄浦江子系统建设项目的中标（成交）结果公告,,黄浦,2023-5-11,黄河勘测规划设计研究院有限公司,8600000
上海市工业技术学校,上海市工业技术学校桌面型五轴机床数字孪生系统中标公告,,松江,2022-8-24,惠脉智能科技上海有限公司,497000
上海市黄浦区卢湾一中心小学,五育并举的数字孪生校园设计和实践服务项目的中标（成交）结果公告,,黄浦,2022-9-28,联通上海产业互联网有限公司,3096000
上海市嘉定区安亭镇城市运行管理中心,安亭镇城市运行一网统管平台设计开发项目的中标（成交）结果公告,专题库、城市运行数据支撑平台、数字孪生基础数据及数字孪生可视化工具，使,嘉定,2022-7-22,中电科数智科技有限公司,2740000
上海市嘉定区安亭镇城市运行管理中心,安亭镇城市运行一网统管平台设计开发项目的中标（成交）结果公告,专题库、城市运行数据支撑平台、数字孪生基础数据及数字孪生可视化工具，使,嘉定,2022-7-22,中电科数智科技有限公司,2740000
上海市经济和信息化委员会,上海市经济和信息化委员会城市数字化转型重大制度规范建设项目的中标（成交）结果公告,思路和举措。 3、开展上海城市数字孪生底座建设研究。 4、开展城市数字,上海,2022-11-29,上海中创产业创新研究院,1198000
上海市临港新片区行政服务中心,上海市临港数字孪生示范区基础平台建设项目的中标（成交）结果公告,,上海,2022-9-13,联通上海产业互联网有限公司,25400000
上海市临港新片区行政服务中心,临港数字孪生示范区基础平台监理项目-临港数字孪生示范区基础平台监理项目成交结果公告,,黄浦,2022-9-9,上海邮电设计咨询研究院有限公司,706800
上海市临港新片区行政服务中心（,临港数字孪生城市示范区基础平台安全测评服务-临港数字孪生城市示范区基础平台安全测评服务成交结果公告,,上海,2023-5-5,上海嘉正通讯技术有限公司,333000
上海市临港新片区行政服务中心（,临港数字孪生城市示范区基础平台软件测试服务-临港数字孪生城市示范区基础平台软件测试服务成交结果公告,,上海,2023-5-5,上海嘉正通讯技术有限公司,408600
上海市临港新片区行政服务中心（,临港数字孪生城市示范区基础平台项目密码应用测评-临港数字孪生城市示范区基础平台项目密码应用测评成交结果公告,,上海,2023-5-5,公安部第三研究所,550000
上海市浦东新区大数据中心,浦东新区时空位置大数据智能服务平台的中标（成交）结果公告,据智能服务平台，建设浦东统一的数字孪生底座，进一步做强时空智能创新引擎,浦东,2022-7-28,上海维智卓新信息科技有限公司,34600000
上海市浦东新区花木街道城市运行管理中心,鹰眼守护建设项目的中标（成交）结果公告,俯视覆盖，并接入街道城运中心的数字孪生城市平台中，实现管理部门对花木辖,浦东,2022-11-17,上海仝方智能信息科技有限公司,3839700
上海市浦东新区市场监督管理局,浦东新区食品生产企业在线智慧监管平台项目的中标（成交）结果公告,用建设，采用大数据、人工智能、数字孪生、数据可视化、虚拟现实应用等新技,浦东,2022-12-6,上海译数信息科技有限公司,2585000
上海市青浦区行政服务中心,青浦区数字孪生三维精模空间地理底图一期功能建设项目的中标（成交）结果公告,,上海,2022-9-22,北京元以论策科技有限公司,6580000
上海市青浦区重固镇城市运行管理中心,青浦区重固镇福贸路幸福街区数字孪生项目的中标（成交）结果公告,,上海,2023-1-13,中国电信股份有限公司上海分公司,3465969
上海市四川北路某单位,上海市四川北路某单位装卸载站点数字全景系统国内公开采购中标公告,生）全景系统 完成15个站点的数字孪生全景系统建设。 详见招标文件第二,黄浦,2023-3-2,上海大学,900000
上海市四川北路某单位,上海市四川北路某单位装卸载站点数字（孪生）全景系统（第二次）国内公开采购中标公告,生）全景系统 完成15个站点的数字孪生全景系统建设。 详见招标文件第二,上海,2023-3-2,上海大学,900000
上海市徐汇区建设和管理委员会,上海市徐汇区建设和管理委员会徐汇滨江地区公共区域综合养护管理项目单一来源单一来源公示,景、人脸识别的安全监控、1:1数字孪生空间、综合养护智能管理系统以及智,徐汇,2022-9-16,上海西岸城市运营管理有限公司,0
上海现代化工职业学院,化工与人类数字孪生科普馆升级改造项目中标结果公示,,上海,2023-6-21,,0
上海中移信息技术有限公司,中国移动上海公司上海中移信息2023年智慧城市数字孪生平台研发服务_中选结果公示,,上海,2023-5-16,上海吉运软件技术股份有限公司,0
韶关华南先进装备产业园管理委员会,华南先进装备产业园智慧园区建设项目中标公告,；2、园区IOC数字孪生可视化：园区综合态势感知(能耗环保)、敏捷招商,韶关,2022-12-16,中国移动通信集团广东有限公司韶关分公司,5001880
设备管理部,莱芜钢铁集团银山型钢有限公司炼钢厂基于数字孪生的转炉炼钢过程多源数据解析与工艺优化项目采购中标公告,,莱芜,2023-3-14,莱芜钢铁集团电子有限公司,0
深圳大学,SZUCG20230068FW 数字孪生城市数据治理技术咨询服务 中标（成交）结果公告,,深圳,2023-4-10,深圳力维智联技术有限公司,380000
深圳供电局有限公司,深圳供电局有限公司基于概率图模型的变电站二次系统数字孪生高级应用研究等服务招标中标公告,,深圳,2022-11-8,南方电网科学研究院有限责任公司,0
深圳市福田区香蜜湖片区建设发展事务中心,福田区香蜜湖片区建设发展事务中心香蜜湖片区数字孪生平台项目,,深圳,2023-6-9,深圳市智慧城市科技发展集团有限公司,24306000
深圳市福田区香蜜湖片区建设发展事务中心,福田区香蜜湖片区建设发展事务中心香蜜湖片区数字孪生平台项目中标（成交）结果公告,,深圳,2023-6-9,深圳市智慧城市科技发展集团有限公司,24306000
深圳市福田区香蜜湖片区建设发展事务中心,福田区香蜜湖片区建设发展事务中心香蜜湖片区数字孪生平台项目,,深圳,2023-5-23,深圳市智慧城市科技发展集团有限公司,24408000
深圳市疾病预防控制中心深圳市卫生检验中心深圳市预防医学研究所,面向全市域基于数字孪生城市的智能化辅助流调和快速处置平台采购结果公示,,深圳,2023-6-9,深圳市智慧城市科技发展集团有限公司,11900000
深圳市龙华区住房和建设局,深圳市龙华区住房和建设局龙华区既有重要公共建筑BIM逆向建模（第一批）中标（成交）结果公告,模型成果上传。模型成果上传至区数字孪生平台、可视化城市空间数字平台(C,深圳,2022-11-16,深圳市华阳国际工程设计股份有限公司,10971911
深圳市深汕湾科技发展有限公司,深汕湾科技园项目7号楼5层01号至02号房招租成交公示,/㎡/月的价格出租给深圳市臻芯数字孪生技术有限公司。 特予以公示。 公,深圳,2022-12-26,深圳市臻芯数字孪生技术有限公司,0
深圳市水务科技有限公司,深圳市水务科技有限公司泵站数字孪生平台建设项目结果公告,,深圳,2023-5-25,深圳盟云全息科技有限公司,1775000
深圳市水务科技有限公司,深圳市水务科技有限公司泵站数字孪生平台建设项目结果公示,,深圳,2023-5-22,深圳盟云全息科技有限公司,1775000
